{
  "asset_type": "character",
  "id": "ruth",
  "display_name": "Ruth",
  "story_ref": "Ruth 1",
  "style_guide_ref": "style_guide_v1",
  "variants": [
    {
      "variant_id": "idle",
      "output_kind": "static_image",
      "resolution": "1024x1024",
      "prompt": "stylized 2D top-down mobile game character, young woman Ruth, humble green-brown travel dress, determined gentle expression, small travel bundle, standing idle pose, top-down 3/4 angle, transparent background, no text"
    },
    {
      "variant_id": "run_cycle_4_frames",
      "output_kind": "sprite_sheet",
      "resolution": "1024x1024",
      "prompt": "stylized 2D top-down mobile game character sprite sheet, 4-frame running animation, young woman Ruth, humble green-brown travel dress, determined gentle expression, small travel bundle, dynamic running pose sequence, top-down 3/4 angle, transparent background, consistent character design across frames, no text"
    },
    {
      "variant_id": "ability_pose",
      "output_kind": "static_image",
      "resolution": "1024x1024",
      "prompt": "stylized 2D top-down mobile game character, young woman Ruth, humble green-brown travel dress, determined gentle expression, small travel bundle, second wind burst, light green speed-trail swirling around her as she surges forward, hopeful expression, dynamic action pose, top-down 3/4 angle, transparent background, no text"
    },
    {
      "variant_id": "portrait",
      "output_kind": "static_image",
      "resolution": "1024x1024",
      "prompt": "stylized 2D character portrait icon, young woman Ruth, humble green-brown travel dress, determined gentle expression, small travel bundle, soft studio lighting, clean circular icon composition, transparent background, no text"
    }
  ]
}